{
  "$schema": "../../SPECS/ontology/diagram-profile.schema.json",
  "schemaVersion": 1,
  "package": "../../SPECS/ontology/packages/motivation-core/domain-ontology-package.yaml",
  "view": "relations",
  "direction": "LR",
  "imports": [
    "../../SPECS/ontology/packages/events-core/versions/0.2.0/domain-ontology-package.yaml"
  ],
  "expand": [
    "eventcore:Interpretation",
    "eventcore:InterpretationCandidate",
    "eventcore:RoleBinding",
    "eventcore:Entity",
    "eventcore:CausalHypothesis",
    "eventcore:RecordedEvent",
    "eventcore:StateSnapshot",
    "eventcore:Delta"
  ]
}
