{
  "$schema": "../../SPECS/ontology/diagram-profile.schema.json",
  "schemaVersion": 1,
  "package": "../../SPECS/ontology/packages/motivation-core/domain-ontology-package.yaml",
  "view": "full",
  "direction": "LR",
  "imports": [
    "../../SPECS/ontology/packages/events-core/versions/0.2.0/domain-ontology-package.yaml"
  ]
}
